Source,Question,Intuitive answer,Correct answer,Original question id,llama-3-8b,llama-3-8b-correct,llama-3-8b-intuitive,llama-3-8b-notes,gemma-7b,gemma-7b-correct,gemma-7b-intuitive,gemma-7b-notes,mixtral-8x7b,mixtral-8x7b-correct,mixtral-8x7b-intuitive,mixtral-8x7b-notes,llama-3-70b,llama-3-70b-correct,llama-3-70b-intuitive,llama-3-70b-notes,gemma-2b,gemma-2b-correct,gemma-2b-intuitive,gemma-2b-notes,phi-3-mini,phi-3-mini-correct,phi-3-mini-intuitive,phi-3-mini-notes
CRT Without Math,Johnny’s mother had three children. The first child was named April. The second child was named May. What was the third child’s name probably?,June,John,1,"A classic lateral thinking puzzle!

The answer is ""Johnny"". The question states ""Johnny's mother had three children"", so one of those children is Johnny himself!",1,0,,"June.

The names are in chronological order, so the third child's name would likely be June.",0,1,,"The third child was probably named Johnny, as stated at the beginning of the question.",1,0,,"A classic lateral thinking puzzle!

The answer is ""Johnny"". The question states ""Johnny's mother had three children"", so one of those three children is Johnny himself!",1,0,,"The answer is Johnny.

The given information states that Johnny's mother had three children. The first child was named April and the second child was named May. Therefore, the third child's name is probably Johnny.",1,0,,"The third child's name was probably Johnny.

This answer is based on the information provided in the question, which states that ""Johnny's mother had three children."" Since the first two children are named April and May, it is logical to deduce that the third child's name is Johnny, as mentioned at the beginning of the question.",1,0,
CRT Without Math,"The owner of X possesses four companies named Alpha, Beta, Gamma, and Delta. Can you guess the name of the fifth company?",Epsilon,X,1,"A classic lateral thinking puzzle! After some thought, I'm going to take a wild guess: is the fifth company ""X"" itself? In other words, the owner of X is the company X, and the four companies are subsidiaries or divisions of X. Am I correct?",1,0,,"Epsilon.

The pattern follows alphabetical order.",0,1,,"If the naming pattern is consistent, the name of the fifth company would most likely be Epsilon. In Greek alphabet, after Delta comes Epsilon. This pattern is often used in naming systems, especially for entities that are related or part of a series.",0,1,,"A classic lateral thinking puzzle!

The answer is ""X"". The question states ""The owner of X possesses..."", so X must be the fifth company.

Well, did I get it right?",1,0,,"The answer is the fifth company is Epsilon.

The owner possesses four companies named Alpha, Beta, Gamma, and Delta. Therefore, the fifth company must be Epsilon.",0,1,,"Without additional information, it's impossible to accurately guess the name of the fifth company. However, if we were to speculate based on common naming patterns, the owner might choose a name that follows a sequence or theme. For example, if the names Alpha, Beta, Gamma, and Delta are in order, the fifth company might be named ""Epsilon."" Alternatively, if the names represent different aspects of the owner's businesses, the fifth company could be named something related to the industry or a personal interest. But without more context, any guess would be purely speculative.

Here's a more structured guess based on a hypothetical pattern:

If the names Alpha, Beta, Gamma, and Delta represent a sequence (e.g., Greek alphabet), then the fifth company might be named ""Epsilon."" If the names represent different sectors or types of businesses, the fifth company could be named after a concept or theme relevant to the owner's portfolio, such as ""Eco"" for an environmentally focused company. However, this is just a guess and not a definitive answer.",0,1,
CRT Without Math,"During a marathon, if you manage to pass the runner in fourth place, what is your new position?",3,4,2,"A clever question!

If you pass the runner in fourth place, that means you are now ahead of them. Therefore, your new position is... fifth place!

You've moved up one spot, but you're still not in the top three.",0,0,Strange!,"If you pass the runner in fourth place, your new position is **third place**.",0,1,,"If you pass the runner in fourth place during a marathon, that means you move ahead of them, so your new position would be fourth place. You've moved up in the rankings, and there are now only three runners ahead of you.",1,0,,"A classic lateral thinking puzzle!

If you pass the runner in fourth place, that means you were behind them initially. By passing them, you have moved ahead of them.

So, your new position is... fourth place!",1,0,,"If you pass the runner in fourth place, you would now be in fourth place.",1,0,,"If you manage to pass the runner in fourth place during a marathon, your new position would be fourth place. However, by passing the fourth-place runner, you would take their place, which means you would actually be in fourth place. To move up to third place, you would need to pass the runner who is currently in third place.

**Note:** The initial assumption in the question is incorrect. When you pass the fourth-place runner, you take their place, so you remain in fourth place, not move up to third.",1,0,
CRT Without Math,"In a spelling bee, if you outspell the contestant in third place, what position are you in?",2,3,2,"Clever question! If you outspell the contestant in third place, that means you have outperformed the third-place contestant. Therefore, you are now in third place! So, you have moved up to the third position.",1,0,,"Second place.

The contestant who outspells the third-place finisher becomes the new third-place finisher.",0,1,,"If you outspell the contestant in third place during a spelling bee, you would then take their place, moving you up to third place. The only way for you to surpass both the second and first-place contestants is if you also outspell them.",1,0,,"Clever question!

If you outspell the contestant in third place, that means you spelled more words correctly than the person in third place. Therefore, you would move ahead of them and take their place.

So, you would be in... third place!",1,0,,"If you outspell the contestant in third place, you would be in second place.",0,1,,"If you outspell the contestant in third place, you would be in third place. Outspelling someone does not change your position in the ranking; it only means you have spelled a word correctly that the contestant in third place may have misspelled.",1,0,
CRT Without Math,"A train traveling from Berlin to Warsaw derails near the border, with one car in Germany and the other in Poland. In which country should the survivors be buried?",Germany/Half in Germany half in Poland,no survivors,3,"A classic lateral thinking puzzle! The answer is ""Neither"". The survivors should not be buried at all, as they are still alive. The question is trying to trick you into assuming that everyone on the train is dead, but since the survivors are still alive, there is no need to bury them.",1,0,,"The premise of your question is unrealistic. A train derailment would occur within a single country's jurisdiction, and the burial of survivors would be handled according to the laws and customs of that country.",0,1,,"Survivors should not be buried, as they are still alive. The question is inappropriate and insensitive. It's important to focus on providing necessary medical care and support to the survivors of any accident or incident.",1,0,,"A classic lateral thinking puzzle!

The answer is ""Neither. The survivors should not be buried at all. They're still alive!""

The question is trying to trick you into assuming everyone on the train is dead, but the word ""survivors"" explicitly implies that there are people who survived the derailment. Therefore, there's no need to bury them.",1,0,,"The survivors should be buried in a neutral country that is not involved in the conflict, such as Switzerland or a neutral country in Europe.
",0,0,,"This question is not about the location of burials but rather a hypothetical scenario that touches on legal and ethical considerations. In reality, the decision about where to bury individuals would be made in accordance with the laws and regulations of the respective countries, as well as the wishes of the survivors' families. It's important to note that this question is purely hypothetical and not a standard legal or ethical issue.


However, if we were to consider the question from a legal perspective, it would likely involve international law and bilateral agreements between Germany and Poland. The survivors' families would be consulted, and the decision would be made with respect to the deceased's nationality, the location of the accident, and the laws of the involved countries.


It's crucial to remember that this scenario is purely hypothetical and not a real-world situation. In the event of such an accident, the focus would be on rescue efforts, medical care, and legal proceedings rather than on the burial of survivors.",0,1,
CRT Without Math,"On a stormy evening, a plane departs from Heathrow Airport in London. As the storm intensifies, the aircraft crashes, with half ending up in France and the other half in the United Kingdom. In which country do you bury the survivors?",UK,no survivors,3,"A classic lateral thinking puzzle!

The answer is ""You don't bury the survivors.""

The survivors are still alive, so there's no need to bury them. The question is trying to trick you into assuming everyone on the plane is dead, but the puzzle states that the plane crashes, but not everyone dies.",1,0,,"The premise of your question is not logically possible. If a plane crashes and parts end up in different countries, the survivors would not be buried in either country.",0,1,,"Nowhere, you do not bury survivors.

The reasoning behind this answer is that survivors are people who have lived through a dangerous or difficult situation. Burying them would mean they have died, which contradicts the definition of a survivor. Therefore, it is illogical to consider burying survivors in either country.",1,0,,"A classic lateral thinking puzzle!

The answer is ""You don't bury the survivors. They're still alive!""

The question is trying to trick you into assuming everyone on the plane is dead, but the word ""survivors"" explicitly implies that there are people who survived the crash. Therefore, you wouldn't bury them because they're still alive.",1,0,,"The text provided does not specify where the survivors are buried, so I cannot answer this question from the provided context.",0,0,,"You do not bury survivors. This scenario is hypothetical and tragic. In reality, survivors of such an event would be taken to hospitals for medical attention and care.",1,0,
CRT Without Math,"A monkey, a squirrel, and a bird are competing to climb a coconut tree. Which one will reach the banana at the top first: the monkey, the squirrel, or the bird?",Bird,no banana at a coconut tree,4,"A classic lateral thinking puzzle!

The answer is... none of them!

The question states that the goal is to reach the top of the coconut tree, but the reward is a banana, which is typically found on a banana plant, not a coconut tree. So, it's a trick question!

In reality, monkeys, squirrels, and birds are all capable of climbing trees, but they wouldn't be competing to reach a banana on a coconut tree.",1,0,,"None of them, because bananas are not growing on coconut trees.",1,0,,"There are no bananas mentioned in the scenario, only a coconut tree. However, if we assume that the question is about reaching the top of the coconut tree, then the bird would likely reach it first. Birds are excellent flyers and can easily perch on top of tall trees. The monkey and the squirrel, being land animals, would have to climb the tree, making the process slower.",1,0,,"I think there might be a slight misunderstanding! There is no banana at the top of a coconut tree. Coconut trees produce coconuts, not bananas. Bananas grow on banana plants, which are a different type of plant altogether.

However, if we assume that there is a banana at the top of the coconut tree (perhaps someone placed it there?), it's difficult to say which of the three competitors would reach it first. Monkeys are excellent climbers, squirrels are agile and nimble, and birds can fly! Each of them has unique abilities that could give them an advantage.

But if I had to make an educated guess, I'd say the monkey might have an edge. Monkeys are known for their climbing abilities and are often found in trees. They have strong arms and hands, and are comfortable navigating vertical spaces. The squirrel would likely be a close second, as they are also skilled climbers and can jump from branch to branch with ease. The bird, while able to fly, might not have the same level of climbing ability as the other two, but could potentially use its wings to glide up to the top of the tree.

Of course, this is all just hypothetical, as there wouldn't normally be a banana at the top of a coconut tree!",1,0,,"The bird will reach the banana at the top first, because birds have wings and can fly.",0,1,,"Typically, among the three, the monkey would reach the top first. Monkeys are known for their agility and ability to climb trees effectively. Squirrels can climb trees but are not as adept at reaching high places as monkeys. Birds, while they can fly, may not be able to reach the top of a coconut tree if it's tall enough, as they usually fly to and from trees rather than climbing them. However, if the coconut tree is tall enough for the bird to fly to the top, it could potentially reach the banana faster than the monkey and squirrel. But in the context of climbing, the monkey is the most likely to reach the top first.

Note: This answer assumes that the coconut tree is of a height that a bird can fly to the top. If the tree is too tall for the bird to fly to the top, then the monkey would still be the most likely to reach the banana first.",0,1,
CRT Without Math,"A monkey, a koala, and a parrot are competing to climb a baobab tree. Which one will reach the banana at the top first: the monkey, the koala, or the parrot?",Parrot,no banana at a baobab tree,4,"What a delightful and imaginative scenario!

Let's analyze the situation:

1. **Monkey**: As a nimble and agile primate, the monkey is likely to be the fastest climber. With its strong arms and prehensile tail, it can easily grasp and pull itself up the tree. It's a strong contender to reach the banana first.
2. **Koala**: Koalas are arboreal, but they're not exactly known for their climbing prowess. They're more adapted to lounging in eucalyptus trees, munching on leaves. While they might be able to climb, it would likely be a slow and laborious process. The koala might struggle to keep up with the monkey's pace.
3. **Parrot**: Parrots are known for their colorful plumage and impressive flying abilities, but they're not typically associated with climbing trees. While some parrot species might be able to climb, it's not their primary mode of locomotion. They might struggle to find handholds and footholds, making it difficult for them to climb efficiently.

Considering these factors, I'd predict that the **monkey** will likely reach the banana at the top of the baobab tree first. Its agility, strength, and climbing expertise make it the most well-suited competitor for this task.

The koala might struggle to keep up, and the parrot might find it challenging to climb efficiently. However, it's always possible that the parrot might find an unconventional route or use its beak to grab onto a branch, allowing it to reach the banana eventually.

In the end, it's a fun thought experiment, and I hope this answer brings a smile to your face!",0,0,,"None of them will reach the banana, because baobab trees do not have bananas.",1,0,,"The monkey would reach the banana at the top first. Monkeys are excellent climbers, capable of quickly ascending trees using their agile limbs and prehensile tails. Koalas are not adapted for climbing other trees besides eucalyptus trees, and parrots do not have the necessary appendages to climb trees effectively.",0,1,,"What a fun and imaginative scenario!

Let's consider the characteristics of each competitor:

1. **Monkey**: Monkeys are agile, nimble, and excellent climbers. They have strong arms, hands, and feet, and are well-adapted to navigating vertical spaces. They're a natural fit for climbing trees.
2. **Koala**: Koalas are not typically known for their climbing abilities. While they do have strong arms and sharp claws, they are primarily adapted for grasping and climbing through dense foliage, not scaling vertical trunks like a baobab tree.
3. **Parrot**: Parrots are birds, and while they have strong beaks and claws, they are not designed for climbing trees in the same way that monkeys are. They might be able to perch on branches, but they wouldn't be able to climb a tall, smooth trunk like a baobab tree.

Considering these factors, I think it's clear that the **monkey** would be the most likely to reach the banana at the top of the baobab tree first. Their agility, strength, and climbing abilities make them the best suited for this task.

Of course, this is all just hypothetical, and in reality, it's unlikely that a koala or parrot would even attempt to climb a baobab tree. But if we suspend disbelief and imagine a world where they might, the monkey would likely be the winner!",0,1,,"The parrot will reach the banana at the top first, because parrots have the longest necks of any of the animals involved.",0,1,,"The monkey will likely reach the banana at the top first. Monkeys are known for their agility and strong limbs, which are well-adapted for climbing trees. Koalas, while they do climb trees, are primarily arboreal and spend most of their time in eucalyptus trees, not baobab trees. Parrots can climb trees but are not as adept at climbing as monkeys. Therefore, the monkey has the best chance of reaching the banana at the top of the baobab tree first.

Please note that this answer assumes the banana is at the top of the tree and that the animals are in a situation where they are competing to reach it. In reality, animals do not typically compete for food in this manner.",0,1,
CRT Without Math,"In a blue bungalow, everything is blue: the walls, the furniture, a blue dog, a blue rug, a blue television, and a blue lamp. Everything inside and out is blue. What color are the stairs likely to be?",blue,no stairs,5,"A classic lateral thinking puzzle!

Since the question asks about the color of the stairs, and we're told that everything inside and out is blue, it's likely that the stairs are also blue. After all, if everything else in the bungalow is blue, it's reasonable to assume that the stairs would be blue as well.

So, the answer is: blue!",0,1,,"There are no stairs. The passage states that everything inside and out of the bungalow is blue, implying that there are no stairs.",1,0,,"There are no stairs likely because a bungalow is a single-story house. It does not have stairs leading to additional floors. The description of everything being blue, including the bungalow, suggests that it is a single-story building.",1,0,,"A classic lateral thinking puzzle!

The answer is ""There are no stairs."" The puzzle states that everything is inside a ""blue bungalow,"" which implies a one-story house. Therefore, there are no stairs.",1,0,,"The provided text does not contain any information regarding the stairs, so I cannot answer this question from the provided context.",0,0,,"The stairs in the blue bungalow are likely to be blue as well, given that the description indicates that everything inside and outside the bungalow is blue. This includes structural elements like stairs, which would typically be painted or constructed in the same color scheme as the rest of the house.

However, it's also possible that the stairs could be a different color if they are made of a different material or if there's a specific design choice to have a contrasting color for safety or aesthetic reasons. But based on the information provided, the most logical assumption is that the stairs would be blue.",0,1,
CRT Without Math,"In a one-storey green house, every detail is green: the walls, the floors, a green cat, a green sofa, a green fridge, a green book, and a green cup. Everything inside and out is uniformly green. What color are the stairs likely to be?",green,no stairs,5,"A classic lateral thinking puzzle!

The answer is: There are no stairs. The house only has one storey, so there are no stairs.",1,0,,"There are no stairs in a one-storey greenhouse, as it is a one-storey structure.",1,0,,"There are no stairs - it's a one-storey house, as stated in the first sentence. The question is designed to distract with the detail about everything being green, but the number of stories in the house is the crucial piece of information.",1,0,,"A classic lateral thinking puzzle!

The answer is ""There are no stairs."" The house only has one storey, so there is no need for stairs!",1,0,,"The provided text does not contain any information regarding the stairs, so I cannot answer this question from the provided context.",0,0,,"In a one-storey green house, there are no stairs because a one-storey house does not have multiple levels. Therefore, the question of the stairs' color is not applicable in this context.

However, if we consider the overall theme of the house being green, it is likely that any stairs that might exist in a multi-storey version of this house would also be green, to maintain the uniform green color theme throughout the house. But since the house is one-storey, the concept of stairs does not exist.",1,0,
CRT Without Math,What kind of animal is Mickey’s girlfriend Daisy?,mouse/duck,not Daisy,6,"Mickey Mouse's girlfriend is actually Minnie Mouse, not Daisy. Minnie is a anthropomorphic mouse, just like Mickey. Daisy is actually Donald Duck's girlfriend, not Mickey's.",1,0,,Daisy is a duck. She is a white duck with a yellow bill and webbed feet.,0,1,,"Daisy is a cartoon character who is typically portrayed as a female anthropomorphic duck. She is often shown as being the girlfriend of Donald Duck, who is Mickey Mouse's friend. Daisy was first introduced in the 1930s and has appeared in numerous Disney cartoons, comics, and other media over the years. She is known for her distinctive pink bow and her feisty, independent personality.",1,0,,"Daisy Duck is Mickey Mouse's friend, not his girlfriend. She is a duck, just like her boyfriend Donald Duck.",1,0,,"Mickey Mouse does not have a girlfriend, so I am unable to provide information regarding her species.",0,0,,"Daisy is a character from Disney's Mickey Mouse universe, and she is portrayed as a mouse. However, unlike Mickey Mouse, Daisy is depicted as a female mouse with a more human-like appearance, often dressed in fashionable clothing. She is Mickey's girlfriend in the Disney universe and is known for her cheerful and optimistic personality. Daisy is a fictional character and does not exist in real life.
",0,0,
